{"$schema":"http://json-schema.org/draft-07/schema#","description":"Machine-readable declaration of how a harness adapter obtains decisions, per docs/FRAMEWORK.md. A manifest may never claim a decision surface it does not interrogate.","properties":{"evidence_class":{"enum":["REPRO","DOC","THIRD-PARTY","INFERENCE","HYPOTHESIS"],"type":"string"},"evidence_emission":{"properties":{"format":{"type":"string"},"layer_attribution_required":{"const":true,"description":"Unknowns carry mandatory layer attribution (INV-004, Option A).","type":"boolean"},"unknown_serialization":{"const":"unknown","description":"Unmatched/no-decision MUST serialize as 'unknown', never 'allow' (INV-005).","type":"string"}},"required":["format","unknown_serialization"],"type":"object"},"harness":{"type":"string"},"harness_version_pinned":{"description":"Exact binary/config version measured. 'unpinned' is allowed ONLY for T3 survey manifests.","type":"string"},"layer_vocabulary":{"description":"Which of rules/approval/sandbox/effect the harness surface covers, and where layers are ambiguous.","properties":{"ambiguous":{"items":{"type":"string"},"type":"array"},"covered":{"items":{"enum":["rules","approval","sandbox","effect"],"type":"string"},"type":"array"},"notes":{"type":"string"}},"required":["covered","notes"],"type":"object"},"manifest_version":{"const":"adapter-manifest.v1","type":"string"},"open_questions":{"items":{"properties":{"question":{"type":"string"},"would_resolve":{"description":"What evidence would resolve this question.","type":"string"}},"required":["question","would_resolve"],"type":"object"},"type":"array"},"oracle":{"properties":{"deterministic_offline":{"type":"boolean"},"invocation":{"description":"Exact command/API used to obtain the harness's own decision, or 'none'.","type":"string"},"reimplements_matching":{"description":"True only if the adapter computes decisions from documented semantics (T2). A T2 adapter must set this true and label its output 'evaluation', never 'interrogation'.","type":"boolean"},"type":{"enum":["native-offline","config-evaluation","none"],"type":"string"}},"required":["type","invocation","deterministic_offline"],"type":"object"},"policy_ingestion":{"properties":{"config_files":{"items":{"type":"string"},"type":"array"},"decision_verbs":{"description":"The harness's own decision vocabulary (e.g. allow/prompt/forbidden).","items":{"type":"string"},"type":"array"},"defaults":{"description":"What the harness decides when no rule matches, stated as documented/observed, never inferred.","type":"string"},"surface":{"description":"Native config surface the adapter reads.","type":"string"}},"required":["surface","config_files","decision_verbs"],"type":"object"},"sources":{"items":{"properties":{"kind":{"enum":["vendor-doc","cli-output","repo-source","third-party","local-observation"],"type":"string"},"reference":{"type":"string"},"retrieved_utc":{"type":"string"}},"required":["kind","reference","retrieved_utc"],"type":"object"},"type":"array"},"spike_answers":{"properties":{"a_native_oracle":{"description":"(a) Is there a deterministic offline way to obtain the harness's own decision? Answer with evidence or 'no'.","type":"string"},"b_documented_semantics":{"description":"(b) If (a) is no: are semantics documented precisely enough for T2?","type":"string"},"c_surface_record":{"description":"(c) If neither: the T3 surface record — surface, defaults, absence of oracle.","type":"string"}},"required":["a_native_oracle","b_documented_semantics","c_surface_record"],"type":"object"},"tier":{"enum":["T1","T2","T3"],"type":"string"},"tier_evidence":{"description":"One-line evidence for the tier assignment.","type":"string"}},"required":["manifest_version","harness","harness_version_pinned","tier","policy_ingestion","oracle","layer_vocabulary","evidence_emission","spike_answers","open_questions"],"title":"Boundary Framework — Adapter Manifest v1","type":"object"}