{"evidence_class":"DOC","evidence_emission":{"format":"finding.v1 (schemas/finding.v1.schema.json) + evidence-bundle.v1 (Merkle-sealed)","layer_attribution_required":true,"unknown_serialization":"unknown"},"harness":"cursor","harness_version_pinned":"docs-2026-10-21 (real CLI not installed on this machine; distributed via curl https://cursor.com/install, not npm — npm 'cursor-agent@1.0.3' is an unrelated third-party package per its package.json; evaluation pinned to vendor docs retrieved 2026-10-21)","layer_vocabulary":{"ambiguous":["IDE settings UI vs CLI token surface differ; the manifest pins the CLI token surface only","three run modes change the decision function: Allowlist (deterministic) vs Auto-review (classifier) vs Run Everything"],"covered":["rules","approval","sandbox"],"notes":"rules: permission tokens (below). approval: interactive prompts; hooks with ask/deny; Auto-review classifier is STOCHASTIC — documented as a layer, never an oracle. sandbox: shell sandboxing in Auto-review; /sandbox. effect: thin — no documented outcome-observation layer. Per Cursor staff (forum 2026-10-05, THIRD-PARTY), a hook's 'ask' answer is silently dropped when the Auto-review classifier deems the command safe; 'deny' is still enforced in all modes."},"manifest_version":"adapter-manifest.v1","open_questions":[{"question":"Default Auto-review mode is unevaluatable offline (stochastic classifier, staff-confirmed hook-ask dropping). A T2 adapter is honest ONLY against Allowlist-mode semantics.","would_resolve":"Cursor ships a deterministic offline evaluation entrypoint (the T2->T1 promotion condition); until then, label Auto-review verdicts unevaluatable."},{"question":"Real CLI not installed here, so no binary pin and no local --help reproduction; npm name is taken by an unrelated package.","would_resolve":"Install the real cursor-agent via the official installer in a scratch dir at a pinned version; re-run the (a)-spike read-only."},{"question":"IDE settings UI vs CLI token surface differ.","would_resolve":"A documented mapping between IDE settings and CLI tokens, or pin the adapter to the CLI surface only (done here)."},{"question":"The CLI requires CURSOR_API_KEY/login — even read-only introspection of a live install needs auth.","would_resolve":"Vendor-published offline decision entrypoint needs no account; otherwise the (a)-spike stays negative."}],"oracle":{"deterministic_offline":false,"invocation":"none — no check/evaluate subcommand documented (CLI surface: -p/--print, --force, --yolo, --mode=plan|ask, --approve-mcps, --workspace, --resume, mcp, generate-rule, ls, update)","reimplements_matching":true,"type":"config-evaluation"},"policy_ingestion":{"config_files":["~/.cursor/cli-config.json (global)","<project>/.cursor/cli.json (project)","team-dashboard -> ~/.cursor/permissions.json -> editor settings (MCP allowlist; REPLACE, not merge)"],"decision_verbs":["allow","deny"],"defaults":"No rule match -> prompt (DOC). Unknowns serialize as unknown with layer attribution, never as allow.","surface":"permissions: { allow[], deny[] } with tokens Shell(commandBase) (first token of the command line; globs; optional command:args syntax), Read(pathOrGlob), Write(pathOrGlob), WebFetch(domainOrPattern), Mcp(server:tool)"},"sources":[{"kind":"vendor-doc","reference":"cursor.com/docs/cli/reference/permissions (tokens, first-token+glob matching, deny takes precedence over allow)","retrieved_utc":"2026-10-21"},{"kind":"vendor-doc","reference":"cursor.com/docs/agent/security/run-modes (Allowlist vs Auto-review vs Run Everything; 'best-effort guardrails rather than a hard security boundary')","retrieved_utc":"2026-10-21"},{"kind":"vendor-doc","reference":"cursor.com/docs/cli/headless","retrieved_utc":"2026-10-21"},{"kind":"third-party","reference":"Cursor staff forum post 2026-10-05: hook 'ask' silently dropped when the Auto-review classifier deems the command safe; 'deny' still enforced in all modes","retrieved_utc":"2026-10-21"},{"kind":"repo-source","reference":"npm cursor-agent@1.0.3 package.json: 'Task sequence creator for Cursor AI agents', author Jacky — unrelated third-party package, not the Cursor CLI (read-only inspection)","retrieved_utc":"2026-10-21"}],"spike_answers":{"a_native_oracle":"NO. Documented CLI surface (-p/--print, --force, --yolo, --mode, --approve-mcps, --workspace, --resume, mcp, generate-rule, ls, update) has no check/evaluate subcommand. The npm package named cursor-agent is an unrelated third-party package, not the real CLI.","b_documented_semantics":"YES, precise enough for honest T2 in ALLOWLIST mode: permission tokens, first-token+glob matching, deny takes precedence over allow. NOT in default Auto-review mode: the classifier is stochastic and staff-confirmed to drop hook 'ask' answers — Auto-review verdicts are unevaluatable and must be labelled so.","c_surface_record":"Not applicable; harness is T2 (Allowlist-mode semantics)."},"tier":"T2","tier_evidence":"Permission tokens, first-token+glob matching, and deny-precedence are documented precisely enough for evaluation in Allowlist mode; the default Auto-review mode's classifier is stochastic and staff-confirmed to drop hook asks, so it cannot be an oracle. (INFERENCE on DOC+THIRD-PARTY)"}